,Rating,Date,Taken,Helpful,Review,Drug,Condition,Major Interaction,Moderate Interaction,Minor Interaction,Dosage
219,1,"April 30, 2017",, 2,"Zyrtec (cetirizine):			“It didn't work, no effect whatsoever”",Cetirizine,Hayfever,0,239,2,oral
220,8,"April 11, 2017",Taken for 1 to 2 years, 3,"“I had been trying this often on, for the last 2 years, first time was 14 pills for 6 dollars but ran out before I noticed any changes in symptoms. The second time was 20 dollars for 70 pills noticed a significant reduction allergic rhinitis, and associating post nasal drip, I am also taking it for atopic dermatitis, even though its not suppose to work, it helps with the itching, and sometimes the prevention of certain seasonal rashes. The greatest benefit was taking it twice one time, and nearly eliminated my nasal allergies for several months. 1 pill=50-80% effective on allergies, less on dermatitis. 2 pills 75-95% effective, although if I take 2 pills I would become somewhat drowsy, taking it once a day, will help build tolerance to drowsiness after”",Cetirizine,Hayfever,0,239,2,oral
221,9,"April 5, 2017",, 5,"“Took 20mg during a summer of very bad allergies when claritin and other meds were not helping sufficiently. Worked excellently for me. 

Only side effects I experienced were mild drowsiness the first few weeks on it and drying of skin and mouth, nothing extra water didn't fix.”",Cetirizine,Hayfever,0,239,2,oral
222,5,"April 4, 2017",Taken for less than 1 month, 4,"“It works. I don't take it everyday, It makes me feel out of it and pretty tired. Not as strong as benadryl which knocks me out cold but still it's pretty strong. If any of these OTC medicines had any type of euphoria they honestly wouldn't be that bad lol, but they just make you feel like you haven't slept in 2 days. I wish I could find an allergy medicine that didn't make me feel tired and weird. I've tried non drowsy Clartin but it doesn't do anything at all.”",Cetirizine,Hayfever,0,239,2,oral
223,5,"March 11, 2017",, 52,"Zyrtec (cetirizine):			“My kids and I have taken Zyrtec for years. It has worked wonderfully for us all BUT. . . It wasn't until my most recent migraine that I realized Zyrtec was making us deathly ill. It dawned on me that my migraines occurred once a month right when we ran out of Zyrtec. The horrible  migraines were withdrawal symptoms!  I immediately stopped giving it to my kids and taking it myself. Yes nose started dripping and I have little hives on my arm but OMG I haven't felt this good in YEARS. No joke, since all 4 of have stopped taking it we've all lost weight. I've lost about 7-10 lbs in a month. My kid's clothes are almost too big. My head is CLEAR, no fog, no drowsy, groggy feeling. I feel like myself again. Do not take Zyrtec!”",Cetirizine,Hayfever,0,239,2,oral
224,7,"February 21, 2017",, 13,"Zyrtec (cetirizine):			“I used Zyrtec for years, not because I wanted to, but because if you stop taking Zyrtec you itch all over constantly.  You don't just itch for 3 days like you do when ceasing other allergy meds, it doesn't stop ever. I was finally able to kick it by decreasing the quantity very gradually for a few months while also taking Benadryl.  It can be done.”",Cetirizine,Hayfever,0,239,2,oral
225,9,"November 30, 2016",Taken for 1 to 6 months, 13,"“I would just like to add a positive review in the midst of all the bad one. I realize that everybody react differentlyto each medicine, so I would like to say that I'm one of the people that had no symtomps whatsoever upon taking this medicine. I have severe rhinitis allergy and have been taking lots of other antihistamines. Cetrizine have work really well with me, all of the other literally made me sleep in the middle of the day! Minimal drowziness, and very effective except for some days where my allergy is so severe, I had to take the medication twice because the first one didn't work but this is a very rare case. So please don't hesitate to try it might work really well for you too!”",Cetirizine,Hayfever,0,239,2,oral
226,1,"October 3, 2016",, 11,Zyrtec (cetirizine):			“A sleeping pill. Terrible.”,Cetirizine,Hayfever,0,239,2,oral
227,,"September 8, 2016",, 6,"“I used to take it for really bad hayfever and it used to the trick, hayfever not so bad. started taking it again at bedtime it acts as sleeping tablet for me. The problem is it seesm to last right through the next day thick head etc and general drowsiness, I rarely get through the day without having to sleep, which sometimes I don't mind but the general sedative effects continue throughout the day”",Cetirizine,Hayfever,0,239,2,oral
228,2,"August 21, 2016",Taken for less than 1 month, 30,"Zyrtec (cetirizine):			“Zyrtec knocks me out. Period. I took a pill at noon and by 2:00 pm I lay down virtually passed out. I slept for two hours straight. In the middle of the day. When I awoke I could barely function. Brain fog, lethargy, no energy. To tell the truth, I was so spaced out for so long that I couldn't tell if helped my sinus condition or not. I wouldn't dream of taking it if I had to drive. It would make a great sleeping pill.”",Cetirizine,Hayfever,0,239,2,oral
229,7,"July 20, 2016",, 19,"Zyrtec (cetirizine):			“I have been trying to deal with drippy eyes and nose (saturating multiple tissues in a couple of hours), and upon awakening clearing throat for over 20 years since moving from the east coast to CA. I  finally decided that I had enough and the doctor told me to try Zyrtec. I started it a few days ago...yep, the drips improved, BUT, I feel exhausted, falling asleep, no energy. I think I may have to deal with the drippy symptoms and tell Zyrtec to take a hike!”",Cetirizine,Hayfever,0,239,2,oral
230,5,"July 18, 2016",Taken for less than 1 month, 16,"Zyrtec (cetirizine):			“Have always had severe allergies since a child, I first used Zyrtec about 14 years ago, worked great but I could barely stay awake at work, it was bad, I'm a dental assistant and I actually fell asleep while assisting(sitting on the assistant chair!) I could barely drive, I confided in a co-worker and she asked me if I was taking anything, I told her just allergy pills, she asked which ones and she said her daughter takes them but she has to take them a couple of hours before bed. I could have easily had a car accident. Anyhow now i'm researching what to take for mango skin allergy, I have Allegra which isn't as good and since I don't work now I'm going to take Zyrtec for it after reading the reviews on it.”",Cetirizine,Hayfever,0,239,2,oral
231,10,"June 18, 2016",Taken for 10 years or more, 12,Zyrtec (cetirizine):			“LOVE Zyrtec D...HATE HATE HATE THE PACKAGING....why can't you put it in a bottle instead of having to open ALL these tiny blister packs!!! This packaging is AWFUL!!”,Cetirizine,Hayfever,0,239,2,oral
232,3,"June 15, 2016",, 18,"Zyrtec (cetirizine):			“I have firstly severe seasonal allergies, and I purchased Zyrtec in hopes that it would be superior to Allegra.  The allergy symptoms improved slightly, but the fatigue was terrible.  It was so bad that I thought I was coming down with the flu.  I slept for five hours straight in the middle of the day after my second dose.  This is not acceptable.”",Cetirizine,Hayfever,0,239,2,oral
233,3,"June 7, 2016",Taken for less than 1 month, 2,"“I used this for hayfever when I was 17 and it made me drowzy. I'm now 26, have suffered from insomnia for many years. Recently, I remembered about these making me drowzy as a teen so I decided to buy some in the hope that they'd help me sleep. They didn't really do much to help; they might have made me slightly more drowzy but they no way had the same effect on me a 9 years ago.”",Cetirizine,Hayfever,0,239,2,oral
234,2,"May 3, 2016",, 2,"“Didn't have much effect, only on occassion

I have kidney problems due to diabetes so Dr. put a stop on more than 30 days”",Cetirizine,Hayfever,0,239,2,oral
235,2,"April 24, 2016",, 5,"“Started taking this medicine for iching after being given it by my doctor. Worked for 1 day and after it didn't.
Made me feel so sleepy but couldn't sleep and make my iching worse, couldn't sleep at night
Wouldn't recommend”",Cetirizine,Hayfever,0,239,2,oral
236,4,"April 14, 2016",, 5,“Made me very drowsy and gave a heavy head feeling - lasted 12 hrs”,Cetirizine,Hayfever,0,239,2,oral
237,4,"March 27, 2016",Taken for less than 1 month, 28,"Zyrtec (cetirizine):			“I'd rather suffer with the allergies than fight the sleepiness.   My Dr said it would not cause drowsiness,  well that's not so.”",Cetirizine,Hayfever,0,239,2,oral
238,10,"February 12, 2016",, 5,“Ya i am using cetrizine from past 5 years i am having a  good relief”,Cetirizine,Hayfever,0,239,2,oral
239,5,"January 13, 2016",Taken for 10 years or more, 6,"“My D.O. and I worked for years to find something that would stop my daily hives and stuffy, runny nose without much success until I tried cetirizine.  My hives and extreme itchiness disappeared after the first dose, and I've been on it since.  For this, I rate it a 10.  Unfortunately, it didn't help my sinus situation at all.  I can't take a decongestant because every time I take one, I get bronchitis.  Silly, I know, but that's my body.  Because cetirizine doesn't help my sinus situation at all, it rates a zero in this category, giving the drug an effectiveness rating of five.”",Cetirizine,Hayfever,0,239,2,oral
240,1,"December 11, 2015",, 2,“The itching all over my body its driving me crazy ”,Cetirizine,Hayfever,0,239,2,oral
241,10,"October 8, 2015",, 12,"Zyrtec (cetirizine):			“After a week using it all symptoms were gone. If I miss it 3 to 5 days , symptoms returned. No drowsiness is the best part.”",Cetirizine,Hayfever,0,239,2,oral
242,5,"July 18, 2015",, 22,"Zyrtec (cetirizine):			“I have been taking Zyrtec for almost 6 years. I was first prescribed Zyrtec to combat my allergies during pregnancy. It worked well except to make me a little drowsy. I only take it seasonally, and it still works well for my symptoms, but the fatigue and drowsiness has gotten worse over time. When I started taking it again for my Spring/Summer allergies this year, the first week was horrible. Even taking it at night I felt so fatigued the next day my muscles ached, and I had to fight to stay awake during the day with my 2 little ones at home. I would fall asleep as soon as my husband got home and sleep 14-15 hours. After about a week my body seemed to adjust and the drowsiness isn't as bad anymore.”",Cetirizine,Hayfever,0,239,2,oral
243,10,"June 28, 2015",Taken for less than 1 month, 7,"“Have had cough since last Christmas. Went to V A (finally) and Doctor prescribed Cetirizine, 10mg. Been taking (just before bed) for about 2 weeks and see an improvement. Get drowsy every now and then but anything is better than that lousy cough. Thank you.”",Cetirizine,Hayfever,0,239,2,oral
244,2,"June 5, 2015",, 49,Zyrtec (cetirizine):			“Zyrtec made me so sleepy I could barely perform my job. Also felt sluggish and dangerous while driving. All I could think of all day was 'I need to go to sleep'...”,Cetirizine,Hayfever,0,239,2,oral
245,10,"December 8, 2014",Taken for 10 years or more, 11,“One each evening and I breathe free. Eliminates the nasal blockage side effect of Trazodone unless I drink beer in the evening!”,Cetirizine,Hayfever,0,239,2,oral
246,10,"July 30, 2014",, 49,"Zyrtec (cetirizine):			“I was suffering really bad with my sinuses over the weekend and could find any relief. The doctor told me in the past to take Claritin, but it has never helped. I was at work this morning and my co worker told me about Zyrtec.  Actually she had one for me to try and within 30 minutes, I could feel the pressure letting up in my
sinus areas and what a surprise, I could breathe so much better, no sneezing, dripping, coughing, horrible pressure in my sinuses.
I was astonished that this little pill could work so effectively. I have to say that I feel like a totally different person today, thanks to Zyrtec. If you haven't ever tried it, be sure to, it is the best of the best. I love you ZYRTEC!”",Cetirizine,Hayfever,0,239,2,oral
247,9,"July 1, 2014",Taken for 10 years or more, 14,“I have taken Zyrtec since it came out years ago. It is the only thing that works for me. And believe me over the last 45 years I have tried everything!  I have year round allergies and dog allergies. Once in a while (when the pollen count hits the roof as it does in Missouri) I have to also take an over the counter medication with it.”,Cetirizine,Hayfever,0,239,2,oral
248,6,"June 10, 2014",Taken for 1 to 6 months, 7,"“I've been on this at 10mg for a few months to fight my hay fever. It has had some effect, my nose isn't running as frequently, but my eyes are watering and are itchy. If anything it has made my eyes worse. At 10mg it doesn't really do much.”",Cetirizine,Hayfever,0,239,2,oral
249,5,"April 21, 2014",Taken for less than 1 month, 61,Zyrtec (cetirizine):			“Took Zyrtec on the advice of my ENT for chronic sinusitis from hay fever. It worked wonders on my sinuses but I can not function on it due to extreme drowsiness and fatigue. I am going to have to stop taking it!”,Cetirizine,Hayfever,0,239,2,oral
250,,"March 25, 2014",, 62,"Zyrtec (cetirizine):			“Zyrtec relieved me of my allergies (except for my worst days), but the side effects were horrible--drowsiness being the worst. I took it at night, however, it still made me so drowsy during the day that in school I fell asleep in every class. Eventually my friends convinced me to stop taking it because they had experienced the same thing. ”",Cetirizine,Hayfever,0,239,2,oral
251,10,"March 6, 2014",Taken for less than 1 month, 37,Zyrtec (cetirizine):			“Zyrtec works well in combating allergies as well as allergic rhinitis. The best I've found.I take at night about an hour before bedtime and sleep like a baby all night. Love it. First time in years I can say I feel great and not congested from allergies.”,Cetirizine,Hayfever,0,239,2,oral
252,5,"August 25, 2013",Taken for 2 to 5 years, 66,"Zyrtec (cetirizine):			“Zyrtec works incredibly well for my severe ragweed allergy.  However, each fall I've noticed it's making me more and more drowsy, to the point that I don't want to do anything and I'm needing naps in the afternoon.  I think I'm going to have to discontinue it, which is frustrating because it works much better than the other meds I've tried.”",Cetirizine,Hayfever,0,239,2,oral
253,,"July 19, 2013",Taken for 1 to 6 months, 4,"“I have taken cetirizine daily for a few months and have noticed my allergies are now much more under control. Unfortunately it hasn't been a complete package: I also use azelastine nasal spray for allergy prophylaxis. Though it is a common side effect, I never experienced drowsiness, even when taking it early in the day.”",Cetirizine,Hayfever,0,239,2,oral
254,8,"July 15, 2013",Taken for 1 to 6 months, 8,"“It worked great on my seasonal allergies.  I've had a real problem with insomnia.  Decided to check for causes and here I am.  I've been extremely sleepy during the day, but chalk that up to the lack of sleep.  I can't sleep more than 2 hours nightly.  It's killing me!  After reading all these reviews, I'm going to skip it today.  I hope I don't begin to itch like so many of you did.  It's a shame.  It made a world of difference to my head and sinuses.”",Cetirizine,Hayfever,0,239,2,oral
255,,"May 28, 2013",, 6,"“Less sneezing, watery eyes, and I could feel the mucus drying up reminiscent of an expectorant medicine.”",Cetirizine,Hayfever,0,239,2,oral
256,9,"April 9, 2013",, 6,"“I have been on cetirizine for about 2 years now. I am now off it now. This medicine can cause severe itching when you come off of it. A full body itch that is completely distracting and makes you want to tear all of your skin off. I have tried to ween myself off of it, lowering my dose from 20mg to 10mg per day gradually over time, but this has had little effect. After about 48 hours of not having the medicine my body goes into full itch. I have to wear winter boots and oven mitts and jean clothing to prevent myself from itching. ”",Cetirizine,Hayfever,0,239,2,oral
257,2,"October 3, 2012",, 18,"Zyrtec (cetirizine):			“It really did not work for me. My eyes itched a bit less, but my nose just kept itching and running. Also sneezed multiple time after 1st dose. Tried a 2nd tablet 4 hours later with no noticeable results. This may work for some people but I get  better relief from Benadryl, which works well but causes drowsiness.”",Cetirizine,Hayfever,0,239,2,oral
258,7,"May 21, 2012",Taken for less than 1 month, 36,Zyrtec (cetirizine):			“I just took Zyrtec for the first time yesterday.  It did make me drowsy but I also didn't get much sleep the night before.  I took it because my eye was so itchy and watery it had become swollen and I was having trouble breathing.  I have had allergies for over 15 years but never took anything before this. Well I don't know if this is an unlisted side effect but I woke up in my sleep cracking up and could not stop laughing for a few minutes even after my husband woke me.  I wonder if anyone else had intense dreams while on this medication.  I don't take anything else that would cause this.”,Cetirizine,Hayfever,0,239,2,oral
259,2,"March 15, 2012",, 33,"Zyrtec (cetirizine):			“Zyrtec worked well for my nasal allergies, but when I tried to stop taking it after several years, I got the skin itch/rash that many have reported.  It was worst for the first few days, but now even a year later I still frequently get a skin rash when I get warm (cholinergic urticaria).  I can't say for sure that the cholinergic urticaria was a side effect of stopping Zyrtec, but skin rashes were never a symptom of mine until I stopped.”",Cetirizine,Hayfever,0,239,2,oral
260,9,"February 28, 2012",, 20,"Zyrtec (cetirizine):			“It works better than any other medicine I have tried.  Down side is the itching, which is caused by its negative effect on the liver.  Therefore, I do not take it everyday.  I have to wait a day or so in between.”",Cetirizine,Hayfever,0,239,2,oral
261,6,"February 27, 2012",, 62,"Zyrtec (cetirizine):			“I thought Zyrtec (cetirizine) was great at first because it worked so well on my allergies. I have gained 15 pounds over 1-1/2 years. I didn't think it was related to Zyrtec, but recently figured out that it is. I am an extremely healthy eater (no processed foods or white flours/sugars), a runner and triathlete without weight issues before Zyrtec. I attributed the weight gain to age, hormones and finally my thyroid. Blood tests ruled out the hormone and thyroid issues. I only take HRT & Zyrtec. I stopped Zyrtec 3 days ago and have lost 2 pounds without any changes in diet. I am willing to suffer with allergy symptoms if I can lose this weight.”",Cetirizine,Hayfever,0,239,2,oral
262,8,"February 10, 2012",, 24,"Zyrtec (cetirizine):			“All day I have had runny nose, itchy watery eyes, sneezing, throat closing. I finally could not take it anymore I did some research online to determine the best OTC medication to use, Zyrtec stood out the most. I figured that it must be pretty strong due to the fact that at one time you needed a script to get it. I took my first tab at 3:00pm its now 3:18. I am starting to feel the effects of Zyrtec I have not sneezed as of yet my watery nose and eye's are starting to clear up. I'm beginning to breathe easier.”",Cetirizine,Hayfever,0,239,2,oral
263,7,"October 22, 2011",, 29,Zyrtec (cetirizine):			“I have been taking Zyrtec for about 2 years for hayfever. I have noticed that it doesn't seem to be working as well for my symptoms as it did at first. I stopped taking it 3 days ago and now I am experiencing severe itching on my hands and feet.”,Cetirizine,Hayfever,0,239,2,oral
264,5,"October 20, 2011",, 1,"“I have severe seasonal allergies, along with allergies to dust and molds. I used Zyrtec or its generic equivalent for a few months, and it never could keep the severe symptoms under control, like other second generation antihistamines. I stopped after about 4 months of use. Zyrtec seems like a viable option for those with average seasonal allergies.”",Cetirizine,Hayfever,0,239,2,oral
265,7,"September 5, 2011",, 16,"Zyrtec (cetirizine):			“This is the only medication that has worked for me so far (besides Benadryl), but it gives me horrible dry mouth and eyes after using it for a few days, and if I take it for longer than that my tongue starts to hurt because of the dryness. I would give it a 10 if it weren't for those symptoms.”",Cetirizine,Hayfever,0,239,2,oral
266,6,"August 8, 2011",, 4,"“Cured my persistent cough, made me drowsy, but also suffered from insomnia and made me feel depressed, wanted to cry at the slightest negative thought or comment, most unlike me.
When I stopped taking pills cough recurred, depression subsided.”",Cetirizine,Hayfever,0,239,2,oral
267,3,"June 9, 2011",, 23,"Zyrtec (cetirizine):			“Make the itching stop. I took this for Hayfever and it worked. BUT, it then caused me to have head to toe bumps and itchiness even after stopping taking it. The itching is keeping me up at night. I am hoping to wait it out and never take it again. Also while I was taking it my eyes and face got really, really swollen. I am still not sure if this was from an unusually bad allergy season or the Zyrtec, but I am going to guess it is the Zyrtec because my allergies have never caused this before (usually I just have sinus and itchy eyes).  ”",Cetirizine,Hayfever,0,239,2,oral
268,3,"June 6, 2011",, 19,Zyrtec (cetirizine):			“I have just decided to stop taking Zyrtec. It worked well on my allergies. However I have had increase in back and joint pain i.e. knee and hip the past two weeks. Not sure it's Zyrtec but felt I'd eliminate it to see if symptoms resolve.”,Cetirizine,Hayfever,0,239,2,oral
269,10,"May 13, 2011",, 3,“Constipation”,Cetirizine,Hayfever,0,239,2,oral
270,5,"November 14, 2010",, 16,"Zyrtec (cetirizine):			“It works well, however, it made me as sleepy as Benadryl.”",Cetirizine,Hayfever,0,239,2,oral
271,10,"November 9, 2010",, 16,Zyrtec (cetirizine):			“I suffered from multiple sinus infections several times a year.  Since taking Zyrtec on a regular basis I have been sinus trouble free for over a year.  THANK YOU ZYRTEC!”,Cetirizine,Hayfever,0,239,2,oral
272,3,"September 15, 2010",, 10,"Zyrtec (cetirizine):			“This product only helped one of my many allergic symptoms, my eyes stopped itching after two hours but my nose kept on running.”",Cetirizine,Hayfever,0,239,2,oral
273,10,"August 8, 2010",, 6,Zyrtec (cetirizine):			“Very effective.”,Cetirizine,Hayfever,0,239,2,oral
274,9,"April 1, 2010",, 30,"Zyrtec (cetirizine):			“Zyrtec is the only medicine that controls my allergy symptoms, but it makes me so tired, sleepy and I always seem to be ""zoning out"".  I even passed a red light at an intersection a few days ago...thankfully no one was hurt.”",Cetirizine,Hayfever,0,239,2,oral
275,1,"March 2, 2010",, 36,"Zyrtec (cetirizine):			“Caused loss of ability to focus, gained 30lbs in six weeks I was on it. Many many more symptoms.  Stopped using and all but the weight went a way.  Weight dropped 10lbs in 2 weeks after stopping. ”",Cetirizine,Hayfever,0,239,2,oral
276,10,"January 11, 2010",, 1,Zyrtec (cetirizine):			“It is amazing!”,Cetirizine,Hayfever,0,239,2,oral
277,1,"November 4, 2009",, 5,"“I had a reaction to cetirizine, racing heart rate and restless. Probably the povidone in it. This was a Member's Mark product purchased at Sam's Club and made in India. Why are they putting povidone in it with the large numbers of people allergic to iodine?? ”",Cetirizine,Hayfever,0,239,2,oral
278,9,"October 1, 2009",, 6,"“I have seasonal allergies, I realized several years ago when I started getting headaches and got stuffy drinking beer and certain other foods/ drinks. So tried various medications but all had some side effects that limited my use. Cetirizine is now available as a generic. The trick with this drug is to take it at around 4-6 in the afternoon. It takes a while to work for me like the next day. By taking it in the early evening you miss the getting tired side effect which many have noted because it takes a while to react, and you are already relaxing after work/school/kids to bed, etc. By the next day it is in your system but your body can adjust to it. The best drug.”",Cetirizine,Hayfever,0,239,2,oral
279,,"September 20, 2009",, 2,“This was really right on point.”,Cetirizine,Hayfever,0,239,2,oral
280,9,"September 18, 2009",, 5,All Day Allergy (cetirizine):			“I have chronic hayfever and take Zyrtec D now - it is the best.”,Cetirizine,Hayfever,0,239,2,oral
281,9,"September 1, 2009",, 3,"“I always wake up in the morning with a runny nose, itchy eyes, etc., but then my doctor gave me Cetirizine. I take it every night so that I won't have to get up every two hours to blow my nose (due to dust and down feather allergies), and it lasts all throughout the day so I feel great-even in spring and summer with all the pollen! I feel great all the time, thanks to Cetirizine!”",Cetirizine,Hayfever,0,239,2,oral
282,10,"August 28, 2009",, 5,"“From 8 year suffering from allergy, asthma attack were normal for me. I had no control on them but when I started taking cetirizine I found a magic to control my attacks.
Now for 4 yrs I""m keeping this tablet in my wallet. Whenever I have any symptoms I take this. It really works like miracle.  Generally in a month I need this 6-8 times this tab. For me it is a life saving drug.”",Cetirizine,Hayfever,0,239,2,oral
