,Rating,Date,Taken,Helpful,Review,Drug,Condition,Major Interaction,Moderate Interaction,Minor Interaction,Dosage
823,9,"August 5, 2011",, 9,Allegra (fexofenadine):			“Allegra has done the trick for me for years. My only disappointment is the expense of the 12-hour dosage now that my insurance company doesn't cover it anymore. It's a better deal to purchase the 24-hour dose but I don't like taking a higher dose of medication if it isn't necessary.”,Fexofenadine,Hayfever,0,57,11,oral
824,9,"July 24, 2011",, 5,Allegra (fexofenadine):			“I love Allegra for my allergies because it doesn't make me drowsy. This week it went to an over the counter medication so my insurance won't pay for it anymore. ”,Fexofenadine,Hayfever,0,57,11,oral
825,9,"June 7, 2011",, 12,"Allegra (fexofenadine):			“I used to take Seldane (worked great) until they took it off of the market and replaced it with Allegra.

180mg dose of Allegra (NOT Allegra-D) does not provide all day relief if I spend extended time outdoors during allergy season.  However, 240mg dose works great.  240mg dose is one 180mg tablet (once daily) at start of day plus one 60mg tablet (12 hour product) before going outside.

”",Fexofenadine,Hayfever,0,57,11,oral
826,10,"April 23, 2011",, 19,"Allegra (fexofenadine):			“I've suffered from allergies for years, but all other allergy medications either make me very drowsy or don't work well.  With Allegra, I have NO side effects and feel 100% better after taking it.  I am so glad that I finally found something that really works for me!”",Fexofenadine,Hayfever,0,57,11,oral
827,10,"April 15, 2011",, 10,Allegra (fexofenadine):			“Very satisfied. Does what it claims to do and I don't feel any side effects.”,Fexofenadine,Hayfever,0,57,11,oral
828,8,"April 4, 2011",, 5,"Allegra (fexofenadine):			“Works much better than other over the counter medicines. My allergy came back this time of the year, and this year got worse. My sneezing won't stop even to the point I get nosebleed. So I tried Allegra, it did suppressed all the sneezing for hours, however my nose still somewhat congested. When they mean ""non-drowsy"", they really mean it. I took other over the counter allergy medicines before, which they listed as ""non-drowsy"", but I constantly found myself falling asleep every now and then.”",Fexofenadine,Hayfever,0,57,11,oral
829,7,"March 29, 2011",, 29,Allegra (fexofenadine):			“Recently I have been having VERY bad allergies and went to the doctor. She said that I should try Allegra (not Allegra-D) and that it is available over the counter. I went to the store but could not find any adult 12 hour Allegra. This disappointed me because I knew the 24 hour pills usually don't work. I went ahead and bought the smallest package of pills I could get (5) of the 180mg dosage. I took one and it cleared up my symptoms and made me feel better but that night I woke up after about 4 hours of sleep and could not get back to sleep. I didn't take one the next day as I wanted to get a good nights rest. Yesterday I took another and the same thing happened again. I just want to SLEEP!”,Fexofenadine,Hayfever,0,57,11,oral
830,,"August 13, 2010",, 22,Allegra (fexofenadine):			“Allegra is really good at working for hay fever but I have been using antidepressants for about two years and I am having some sleeping problems now. Using Allegra is making it hard to get to sleep early.”,Fexofenadine,Hayfever,0,57,11,oral
831,10,"December 20, 2009",, 46,"Allegra (fexofenadine):			“I suffer from chronic sinusitis caused by allergies.  I also had a bad case of bronchitis a year and a half ago and 3 respiratory infections since.  I have tried a bunch of antibiotics, Claritin D, Zyrtec, Bendryl, Mucinex, Singulair, cough syrups and other OTC decongestants, herbal supplements, steroids, and the Neti Pot. Only the Neti Pot helped me feel better for an hour or so and washed away a lot of the allergens but the sinus inflammation and bronchial irritation due to post nasal drip returned fast. I just started using Allegra 3 days ago and the difference is remarkable.  I can breath again! I also sleep better and I don't feel tired all the time. I have not experienced any side-effects so far.”",Fexofenadine,Hayfever,0,57,11,oral
832,10,"November 24, 2009",, 25,"Allegra (fexofenadine):			“I started having horrible allergy/sinus problems in April of this year. I was having horrible migraine-like sinus headaches every single day. I tried EVERYTHING: Benadryl, Tylenol Sinus & Congestion, Sudafed PE, Advil Sinus & Cold, prescription Claritin, and a whole lot of natural remedies such as Apple Cider Vinegar (horrible taste ugh) and Cayenne Pepper. Then the doctor gave me Allegra D-24 hour and I was cured within an hour! It was amazing! I recently ran out and on day 2 my horrible headaches were back. I went to the doctor and she refilled my Allegra D-24 hour and I was feeling normal again in an hour! I highly recommend this! (The Allegra D-12 hour did not work for me only the 24 hour version.)”",Fexofenadine,Hayfever,0,57,11,oral
833,8,"September 15, 2009",, 5,"“I find Fexofenadine HCL very effective against my allergies which seem to be a year-round problem, but I have also found it gives me a headache which doesn't go away with your average OTC medicines.  I tried my mother's prescription, same dosage, different manufacturer, and no headache (weird) so I may have my Doctor to give me some but otherwise it's GREAT!”",Fexofenadine,Hayfever,0,57,11,oral
834,10,"September 9, 2009",, 14,"Allegra (fexofenadine):			“Allegra is the only allergy medicine that helps me.  Other prescription or over the counter medicines just seem to mask the problem, and they do not even do it that well for me.  My insurance company (Aetna) stopped covering it last year and I decided to use other brands because of the price of Allegra.  Next year I think I'll pay the money for the Allegra.”",Fexofenadine,Hayfever,0,57,11,oral
835,7,"May 28, 2009",, 18,"Allegra (fexofenadine):			“It works great! My nose is like 98% of the time clear, just some sniffles every now and then when it's windy. I'd recommend it to anyone who has a stronger stomach (as it caused me to go to the toilet more often as a side effect), then me. Hardly any fiber in my diet, I'm trying to change that.”",Fexofenadine,Hayfever,0,57,11,oral
836,10,"May 11, 2009",, 24,Allegra (fexofenadine):			“I have taken it for years. It does not make me drowsy and works great. ”,Fexofenadine,Hayfever,0,57,11,oral
837,,"March 30, 2009",, 11,Allegra (fexofenadine):			“It works great. I love it.”,Fexofenadine,Hayfever,0,57,11,oral
838,10,"March 11, 2009",, 7,"“Have used fexofenadine seasonally, August through to the first hard freeze in my area. About three years ago, started using fexofenadine daily. An early AM 180 mg dosage. During the entire period, I have been under the supervision of an allergy specialist (doctor).

Fexofenadine completely eliminates all hay fever type seasonal allergies. Period. About three years ago, I noticed that it also greatly reduces multiple food intolerances that substantially had limited my diet. Since then I have taken the drug daily. About two years ago, I noticed that my blood pressure was lowered from around 139 / 89 to 110 / 78. That effect continues when I use it.”",Fexofenadine,Hayfever,0,57,11,oral
839,10,"December 31, 2008",, 29,"Allegra ODT (fexofenadine):			“My son was given samples of Allegra ODT by his pediatrician to use until we could get the prescription filled. It worked wonders on his seasonal allergies. He took it regularly while the samples lasted. It was wonderful. Unfortunately, we've been unable to get the prescription filled because the insurance feels something cheaper should work just as well. We want Allegra ODT.”",Fexofenadine,Hayfever,0,57,11,oral
840,10,"September 8, 2008",, 28,Allegra (fexofenadine):			“Only Allergy Medicine that has helped me. Expensive but it works like a charm.”,Fexofenadine,Hayfever,0,57,11,oral
841,9,"June 4, 2008",, 48,Allegra (fexofenadine):			“First allergy medicine that has helped me. Love it.”,Fexofenadine,Hayfever,0,57,11,oral
842,2,"September 13, 2020",, 4,"Nasacort (triamcinolone):			“I have awful airborne allergies. I used nasacort and had great relief, although I have always said I wouldn't use steroids. It was all good until I started feeling very anxious, panic attacks having heart palpitations, pain in my sides over my kidneys, feeling generally sick, felt like my blood pressure was really high, and my hair fell out! I'm not kidding you! Hair loss is a side effect of triamcinolone,  and half of my hair fell out! After trips to 4 different Drs (cardiologist, endocrinologist, dermatologist, and primary Dr) who found nothing in the tons of labs they drew, it was the triamcinolone in nasacort! It took almost 2 years for my hair to grow back. I ended up hospitalized in atrial fibrillation for 2 days also at that time because of it. I had never had it before and have never had it again.  I am a registered nurse of 33 years.  If you use this medicine daily for any extended period of time, you will probably have severe withdrawal symptoms like I did.”",Triamcinolone nasal,Hayfever,0,30,0,nasal spray
843,1,"August 22, 2020",Taken for less than 1 month, 0,"Nasacort (triamcinolone):			“Took first dose of Nasacort about 8:30am. At 9am got up out of chair could barely walk. Dizzy, nausea, sick at stomach. Went to bed. After 3 hrs got up felt worse. Went to neighbors where could be around someone. After 5 hrs symptoms began to go away. It has now been 7 hrs 15 mins. Still not back to normal.”",Triamcinolone nasal,Hayfever,0,30,0,nasal spray
844,10,"August 17, 2020",Taken for less than 1 month, 0,"Nasacort Allergy 24HR (triamcinolone):			“For years, I have suffered with sinus headaches and sinus infections, with little relief from any of the medicines my doctor prescribed.  I have taken Allegra, Claritin, Flonase, and Zyrtec, and none of them worked.  Finally, my doctor encouraged me to try Nasacort.  Nasacort took a few days to get into my respiratory system, but it worked.   All of our bodies are different, so Nasacort might not work for everyone, but it worked for me.”",Triamcinolone nasal,Hayfever,0,30,0,nasal spray
845,10,"August 16, 2020",Taken for less than 1 month, 1,"Nasacort Allergy 24HR (triamcinolone):			“For years, I have suffered with sinus headaches and sinus infections, with little relief from any of the medicines my doctor prescribed.  I have taken Allegra, Claritin, Flonase, and Zyrtec, and none of them worked.  Finally, my doctor encouraged me to try Nasacort.  Nasacort took a few days to get into my respiratory system, but it worked.   All of our bodies are different, so Nasacort might not work for everyone, but it worked for me.”",Triamcinolone nasal,Hayfever,0,30,0,nasal spray
846,1,"June 5, 2020",Taken for 2 to 5 years, 3,"“Do not use if you suffer from any anxiety!!!
I've suffered extreme anxiety and back to back panic attacks. I have generalized anxiety disorder and using this has triggered the absolute worst anxiety symptoms (shortness of breath, dry mouth, sore throat, clammy palms, tingling arms, and tightness or pain in center of back). Plus, it stopped working after extended use. It may work for some but please use cautiously if you suffer from anxiety issues.”",Triamcinolone nasal,Hayfever,0,30,0,nasal spray
847,3,"March 1, 2020",Taken for less than 1 month, 7,"Nasacort (triamcinolone):			“I was directed by Dr to take  Nasacort along with antibiotics for a sinus infection. On the first day I take it (morning) I noticed that at bedtime I have trouble falling asleep. Found it odd. Second night, same thing but also feeling anxious and a general feeling of  not feeling better. Third day, again hard time falling asleep. After 3 days tried  to figure out what is going on. 
Then realised it  started taking Nasacort.... bingo... stopped it and everything is coming back to normal. Can’t trust the manufacturer to tell you all the side effects but thank goodness for consumers like us to do so. 
Not worth it.”",Triamcinolone nasal,Hayfever,0,30,0,nasal spray
848,3,"January 16, 2020",, 2,"“I've had Chronic Rhinitis for 40+ years and I've tried many oral medications over the years with minor benefits, but not enough to offset the side effects.  I've basically learned to live with constant post-nasal drainage and sinus congestion.

I used Nasacort for a month and while my congestion and PND abated to some extent, what mucous I did have was very runny, so I had a rather drippy nose all the time.

Unfortunately, just as my first bottle was starting to run out I started to experience what I can best describe as an anxious and jittery feeling in my chest.  It left me feeling very unsettled and fidgety.

Yesterday, the congestion and PND flared up significantly, so I decided to try Nasacort once more, which I did in the late afternoon.  When I woke up this morning, the anxiety, tension and jitters were all back with a vengeance.  So to me, it's conclusive that these side effects are real and not worth the benefits.  Too bad because they really did help the Rhinitis!”",Triamcinolone nasal,Hayfever,0,30,0,nasal spray
849,10,"January 12, 2020",Taken for less than 1 month, 2,"Nasacort AQ (triamcinolone):			“I was hooked on Afrin nasal sprays for years and I got what's called rebound congestion. all of my life I have had sinus problems. I was told to try Nasacort or a steroids spray to help get me off.  I tried Nasacort and after about a week I was totally off that rebound congesting Afrin. I haven't felt this good since I was a kid, my sinuses  feel great and I can't believe this stuff really works. I'm so happy I'm not miserable anymore.”",Triamcinolone nasal,Hayfever,0,30,0,nasal spray
850,8,"November 9, 2019",Taken for 2 to 5 years, 5,"Nasacort (triamcinolone):			“This has worked great for me. I have seasonal allergies and this twice a day along with a Claritin each morning has changed my life. The only side effect I've had is, when I quit taking it each fall, I experience drying around the nostril area and sore, watery eyes. It goes away after a few weeks.”",Triamcinolone nasal,Hayfever,0,30,0,nasal spray
851,10,"October 10, 2019",, 8,"Nasacort (triamcinolone):			“I’ve had allergies for the last two years and my symptom is chronic congestion. I had my allergies tested and I am allergic to just about everything environmental.  Decided to do the shots but  in the meantime I’ve been using Nasacort. I am a super naturalist and dislike taking meds taking but this medication has been a lifesaver as I can’t sleep with a congested nose. Give it at least a week to work! It’s magic. I have not experienced adverse reactions other than possible heart palpitations maybe. I’ll use it at least for another year while allergy shot kick in. 
Totally recommend.”",Triamcinolone nasal,Hayfever,0,30,0,nasal spray
852,1,"July 31, 2019",Taken for less than 1 month, 13,"Nasacort (triamcinolone):			“My experience was awful. I paid around $40 for this and it made me nauseous, made my heart pound, and made me feel anxious...all after only one use. Then later there was a crash and I felt exhausted. It helped slightly with my allergies but not too much, and NOT worth it.”",Triamcinolone nasal,Hayfever,0,30,0,nasal spray
853,3,"May 10, 2019",Taken for 1 to 6 months, 5,"Nasacort (triamcinolone):			“This medication caused me to feel loopy, anxious but tired at the same time, and I gained weight.  I couldn't lose weight for anything.  I came off of this and lost 10 lbs in 2 weeks.  Who knew?  I know it's a steroid but I had no idea it was that strong.  I'm going to try Claritin D again.  

Medication did make me breathe easier.  I had very itchy eyes however which could've been from the pollen.  Sore throat however.  I have it a 3 because it makes be breathe like a champ.”",Triamcinolone nasal,Hayfever,0,30,0,nasal spray
854,1,"April 25, 2019",Taken for less than 1 month, 9,"Nasacort (triamcinolone):			“My husband took this before he went to bed the other night. Had only used this medicine 1-2 times before. I was woken up to him having a seizure . It seemed like it lasted forever but it was the scariest thing ever seeing your husband helpless. So far all tests (bloodwork, CAT scan and EEG have come out good ). The only thing he did different was take Nasacort that night. I think he had an allergic reaction. I will never let him or anyone I know use this!”",Triamcinolone nasal,Hayfever,0,30,0,nasal spray
855,4,"April 7, 2019",Taken for less than 1 month, 10,"Nasacort (triamcinolone):			“Nasocort nasal spray put me on edge and made me angry. Discontinued. It worked, but the side effects are not worth it.”",Triamcinolone nasal,Hayfever,0,30,0,nasal spray
856,5,"January 19, 2019",Taken for 5 to 10 years, 14,"Nasacort (triamcinolone):			“Nasacort is a mixed bag. It relieved my allergies to cats and ragweed like nothing ever has. Also, to my surprise, it reduced chronic pain that I've had for decades. I had the spunk of an Energizer Bunny, but Nasacort made my chronic insomnia much worse. Even though it gave me boundless energy, I was only able to sleep for four hours at night---every night. I am a non-confrontational person who hardly has a temper, but the Nasacort made me feel irritable and angry to a degree that was difficult to control. I am 67 years old and show early signs of cataracts. The raging insomnia and irritability/anger were also unacceptable, so I decided to discontinue Nasacort. I used the Nasacort for approximately five years and am now back where I started, looking for something safe for treating severe allergies. Sigh.....”",Triamcinolone nasal,Hayfever,0,30,0,nasal spray
857,1,"November 12, 2018",Taken for less than 1 month, 5,Nasacort (triamcinolone):			“I only bought nose spray once before. I bought a $4 equate (Walmart brand) that night after spraying it my nose cleared and the sinus pressure went away for almost 24 hrs. I bought Nasacort and all it did was run out of my nose. I did not feel any relief of any kind. I am the most miserable I have ever been.”,Triamcinolone nasal,Hayfever,0,30,0,nasal spray
858,5,"August 13, 2018",Taken for 2 to 5 years, 3,"Nasacort (triamcinolone):			“I have used Nasacort for three years. I have had hayfever most of my life, changing medicines every few years as they become less effective. Nasacort was amazing for the first two years. For the first time in my adult life, living through allergy season with no symptoms, and no side effects, was an absolute wonder.
Now, year three, since day one of starting the spray (one each nostril per day) I have been slowly coughing up all of my lungs. I can only hope I have done no damage.
Time to move on, and find the next best thing.”",Triamcinolone nasal,Hayfever,0,30,0,nasal spray
859,10,"June 13, 2018",Taken for less than 1 month, 2,Nasacort Allergy 24HR (triamcinolone):			“Works great! I suffer from seasonal allergies almost every year. I've tried other nasal sprays including Flonase without any good results. Nasacort is the only one that works for me. It does take about 2-3 days to get 100% relief but on the first day I used it I did notice a significant improvement in my symptoms. I highly recommend this nasal spray to anyone who suffers from seasonal allergies.”,Triamcinolone nasal,Hayfever,0,30,0,nasal spray
860,5,"April 8, 2018",Taken for 1 to 6 months, 19,Nasacort (triamcinolone):			“I am a young woman and have been taking this at night to clear my allergies because zertec just won't cut it anymore and this has been working. I haven't had any bad allergy symptoms and can breathe freely. But since taking this medicine I have had some adverse side effects. I have been woken up in the middle of the night from my heart racing and what feels like a panic attack. It is so bad I have to get up and turn on a light and go do something just so I can calm myself down let alone get myself to sleep.  I have decided that this is just too much to go through for clear sinuses so I am no longer going to take this medicine and try something else.”,Triamcinolone nasal,Hayfever,0,30,0,nasal spray
861,10,"April 8, 2018",Taken for 1 to 6 months, 10,Nasacort (triamcinolone):			“Fantastic and no side effects. Flonase was horrible - didn’t work and gave me horrible anxiety. Generic version of Nasocort has been wonderful.”,Triamcinolone nasal,Hayfever,0,30,0,nasal spray
862,1,"March 23, 2018",Taken for less than 1 month, 6,"Nasacort (triamcinolone):			“Been taking for a week, so far its useless.”",Triamcinolone nasal,Hayfever,0,30,0,nasal spray
863,10,"March 4, 2018",Taken for less than 1 month, 4,"Nasacort (triamcinolone):			“Today was my first time trying it and it works! I could tell when I first sprayed it;  it seemed to open me up then. I used to use Claritin d (til it stopped working), then Zyrtec, then Flonase but they all seemed to take time to work. Didn’t have that problem today. Plus it was cheaper than the Flonase and I had a coupon on top of that!”",Triamcinolone nasal,Hayfever,0,30,0,nasal spray
864,7,"February 16, 2018",, 4,"Nasacort (triamcinolone):			“Just tried it for the first time today. Although my nose isn't completely clear there is a huge difference than when I didn't have it. I was using Afrin and Nasacort didn't seem to have that immediate clearance that Afrin provided, but it was good because this meant that the addictive effect of total and immediate clearance was not there..so Nasacort was more gradual and less harsh. I love it!”",Triamcinolone nasal,Hayfever,0,30,0,nasal spray
865,,"February 13, 2018",, 7,"Nasacort (triamcinolone):			“While using the product for about 2 to 3 weeks it cured the allergy symptoms but left me with what seemed to be manageable anxiety and lite panic attacks. Even though I have some holistic cures for anxiety ( holy basil tea or passion flower drops) the ongoing uneasiness from the drug made me stop. The first day off the medication I felt odd , the second day I was a little stronger, and the 3rd day I had a real panic attack. I wouldn't suggest the product to anyone who has had ""any anxiety issues"" in their life. At least I know I have a strong heart...”",Triamcinolone nasal,Hayfever,0,30,0,nasal spray
866,5,"February 11, 2018",, 5,"Nasacort (triamcinolone):			“I have a constant runny nose, but worse, as soon as I lie down at night my nose becomes stuffed. I'm a stomach sleeper, so my head is always turned to one side. The bottom nostril becomes stuffed, so I switch sides, and so on through the night. I used Nasacort for 2 weeks and it was magical -- until my nose began bleeding and gooping up inside with snotty, bloody clumps. So, I had to give it up (Nasacort even let me sleep at night after the bloody clumps began) because I don't think it's normal to have chunky scabby blood clogs. Still haven't found a fix for my night problem (BreatheRight helps a bit, but the adhesive makes my skin itch).”",Triamcinolone nasal,Hayfever,0,30,0,nasal spray
867,10,"January 12, 2018",Taken for 2 to 5 years, 11,"Nasacort (triamcinolone):			“This is the only medication that worked for me.  A lifelong history (50+ yrs) of my nasal passages swelling up when sleeping or anytime I wasn't upright.  I use once a day (at night) one spray each nostril and I now can sleep soundly with no stuffiness!  No side effects for me, no jitters etc.  My life has improved since using it.”",Triamcinolone nasal,Hayfever,0,30,0,nasal spray
868,1,"December 5, 2017",Taken for less than 1 month, 2,Nasacort (triamcinolone):			“Didn't help my runny nose at all unfortunately.”,Triamcinolone nasal,Hayfever,0,30,0,nasal spray
869,,"November 9, 2017",Taken for less than 1 month, 14,Nasacort (triamcinolone):			“I am very sensitive to all medications so was so happy to try Nasacort. It worked really well for my allergies but after two weeks of using it the side effects were awful. Right off the bat my right eyelid was twitching nonstop. I put up with it since I could finally breath but then the heart palpitations started. It got so bad one night that I thought I was having a heart attack and almost passed out while I was driving. As soon as I stopped using Nasacort the symptoms went away. It also caused anxiety  for me. I would not recommend this product to anyone. Hoping there is no permanent damage to my heart!!”,Triamcinolone nasal,Hayfever,0,30,0,nasal spray
870,1,"October 18, 2017",Taken for less than 1 month, 9,Nasacort (triamcinolone):			“This drug almost killed me. I had every side effect to the extreme. Sleep deprivation led to me being delirious. At the hospital I went into anaphylactic shock. My heart hasn’t ever fully recovered. Stay away from this rubbish “medicine.””,Triamcinolone nasal,Hayfever,0,30,0,nasal spray
871,,"September 16, 2017",Taken for less than 1 month, 6,"Nasacort (triamcinolone):			“I hit google as soon as I first tried this product.  Within 10 minutes of taking this product I felt like I was high as a kite, kind of feels like a stimulant, I can see how someone who are younger could have a panic attack if they did not understand what is going on. As for what its supposed to do my nose is clear as a whistle but it is 10 PM and I am freakin wired.”",Triamcinolone nasal,Hayfever,0,30,0,nasal spray
