,Rating,Date,Taken,Helpful,Review,Drug,Condition,Major Interaction,Moderate Interaction,Minor Interaction,Dosage
490,3,"February 22, 2017",Taken for less than 1 month, 9,"“So allergist gave me sample, have been using Flonase.  The after taste is awful but worse is the subsequent coughing, nausea with vomiting shortly afterwards, slight headache.  Did not realize extra tiredness was also from this.  It does feel like the nasal passages are opened up more but the morning porcelain throne is not worth it. And no not pregnant! Ain't possible. Definitely will inform MD.”",Dymista,Hayfever,23,189,2,nasal spray
491,10,"January 28, 2017",, 23,"“I've had sinusitis for over 12 months which resulted in nasal polyps. Due to have polyp removal operation this year (2017) but due to the effectiveness of Dymista I am hoping that it will shrink the polyps enough that I won't need to have the surgery. I've tried every nose spray and also steroid drops in the past with no effective results. 4 days into the treatment using 2 sprays twice a day and I am already seeing drastic improvements it does cause me to have severe sneezing fits for a few minutes after using it but that's nothing compared to what I've been going through over the past 12 months. Yes occasional bad taste but I don't see what people moan about this. What's worse, a bad taste for a few minutes or relief from your symptoms.”",Dymista,Hayfever,23,189,2,nasal spray
492,9,"January 25, 2017",, 13,"“I have always had very mild asthma that would go into remission for years. Over the last year however, my asthma had worsened to the point where even stronger dose preventers didn't work effectively. I'd go to sleep clutching a Ventolin spray as I'd invariably have an asthma attack during the night. Every night. Often I would wheeze all day.

My asthma specialists suspected allergies were distabilising my asthma and added dymista to my preventer. 

Within 24 hours I was a new person. I haven't used ventolin in 6 weeks nor had an asthma attack. On the downside the after taste is truly awful and lasts for hours and there is some minor taste sensation alteration but this is a small price to pay for breathing properly.”",Dymista,Hayfever,23,189,2,nasal spray
493,10,"December 13, 2016",, 26,"“MIRACLE DRUG. Seriously. Hayfever my entire life. Hayfever x 10000 in Melbourne, Australia. Tried at least 10 different allergy tablets and sprays and eye drops, from both US and Australia. I eat local pollen honey and have an air purifier in my house that runs 24/7 and still my symptoms persisted.  Dymista immediately relieved my allergic symptoms -- I can breathe, I can go outside, my eyes don't itch, my hives have stopped, sneezing stopped, runny nose has stopped, headache stopped. I can't rave enough about this one. Can't believe I didn't start it sooner. If you're suffering seasonal allergies just go to your doctor, get a prescription and feel the relief.”",Dymista,Hayfever,23,189,2,nasal spray
494,1,"December 3, 2016",, 5,"“I have a nasal disorder , depending which side i tried to sleep , that nostril  blocks if i turn to the other side that nostril will block  , i had a salivary gland problem that made my left side of my face swelled up especially under the ear , y went to the hospital , i was diagnosed with salivary canal infection , was sent to a nose throat and ear specialist , he prescribed  3000 ml of antibiotics a day for a period of ten days , i went back for a check up i was feeling better , y mentioned to the doctor that i had that issue with nose blockage , he prescribed Dymista  nose spray , i used it the same day the  next day my nose bled followed by 14 of these symptoms ”",Dymista,Hayfever,23,189,2,nasal spray
495,1,"November 24, 2016",, 13,"“I started the Dymista to fight allergies and the next two days I was dragging and begging to fall asleep. I thought ""I must be fighting a cold!"" Nope. Just looked it up and read the reviews. The biggest side effect is drowsiness. Ugh. So annoyed that I just used, then thought to look it up. Thanksgiving is at my house tomorrow and I'll be nodding off for my family. I also have very limited taste and smell.”",Dymista,Hayfever,23,189,2,nasal spray
496,2,"November 17, 2016",Taken for less than 1 month, 15,"“My doctor prescribed this instead of the Flonase I've taken for a month. I have severely swollen sinuses, history of sinus surgeries. After a few days of use the headache has gotten so bad I have to stop use. I've had more bad side effects than benefits, including painful sinuses and dry nose. I'm better off without it.”",Dymista,Hayfever,23,189,2,nasal spray
497,9,"November 10, 2016",Taken for 1 to 2 years, 16,"“Allergies had absolutely taken over my life. I was regularly sniffly if not in full blown sneezing attacks all year round. I'd tried everything I could find and nothing ever worked. When a new doctor suggested I tried this I didn't expect it to my any different but its been life changing. As long as I keep taking this one or two sprays a day, it keeps my symptoms at bay. If I forget it for two consectuive days they come back with a vengeance. Its also settled my asthma so I've been able to reduce my inhalers. Yes there's a taste from it but honestly I still couldn't recommend this enough. I'm in northern Ireland so get it free on prescription but I would absolutely pay for if I needed to.”",Dymista,Hayfever,23,189,2,nasal spray
498,1,"September 6, 2016",, 9,"“My ENT suggested I try Distma for allergies since Flonase had not helped. Three hours after Distma's first use I had intense needle stabbing pains in left side of head from crown moving down to ear/ temple area & then back up for ""30 hours""! Very drowsy & in a haze. Then when I walk can hear something drumming in my hear, so it's back to the ENT tomorrow to find out the damage! ""Do Not Use this product is my suggestion!""  It seems I have a perforated eardrum!”",Dymista,Hayfever,23,189,2,nasal spray
499,4,"August 18, 2016",, 5,"“I took this after having weaned off of Sinex nose drops due to allergies to pollens. It worked fine, but could not stand the aftertaste. I tried everything to get it to go away! I also noticed being sleepy and having dreams. Why would it make me so sleepy? Long story short, I discontinued it. I'd rather go back to Sinex and not have bad aftertaste and be more alert.”",Dymista,Hayfever,23,189,2,nasal spray
500,10,"July 3, 2016",, 13,"“I have suffered from hay fever allergies really bad for 5 years each year getting worse spent a fortune on prescriptions and many visits to doctors trying everything on chemist shelf. Havin sneezing attacks 50 at a time taking my breath away, running nose, sore throat, cough for 4 months of the year. Help finally arrives from a new nurse at my doctors that had really bad attacks like me and used Dymista nasal spray WOW change my life over night yes the taste is bad but just have a little water after and it's gone my parents get some sleep at night now cos only one or two sneezes and my head and runny nose has stopped I feel human again, but in England it is expensive that's why some doctors don't offer it.”",Dymista,Hayfever,23,189,2,nasal spray
501,10,"June 27, 2016",, 9,"“I've had year round allergies for years and have tried zyrtec, Claritin, Allegra, Flonase, and numerous eyedrops with nothing completely alleviating my symptoms. Flonase was probably the closest, gone were the itchy eyes, puffy face, constant clearing of throat, runny nose and sneezing, but I still had that annoying itchy nose. My doctor tried dymista last year, and wow, I love it! It works amazing at alleviating all my symptoms, I feel so much better, it is really expensive though but their is a coupon to help with the copay. The after taste is horrible but a glass of water and piece of gum gets rid of it. Also, I do sneeze or feel on the verge of sneezing for about a minute after taking it. Overall, I love it.”",Dymista,Hayfever,23,189,2,nasal spray
502,1,"June 8, 2016",Taken for less than 1 month, 19,“I was prescribed Dymista after getting a severe blocked nose caused by a cold. I used Dymista for a total of 3 days twice a day (as directed by my doctor) and have since lost my sense of taste and smell. It's been 2 days since I've stopped using the spray and still haven't restored my taste or smell. Freaking out that this might be permanent?! Nothing is worth losing your sense of smell and taste - this is a horrible feeling!!”,Dymista,Hayfever,23,189,2,nasal spray
503,10,"June 1, 2016",, 11,"“this nasal spray has been life changing for me. having suffered with allergy problems all year round for over 25 years ( constant sneezing,runny nose,itchy eyes and headaches) all of these symptoms have completely stopped. in short a miracle drug!!!!!”",Dymista,Hayfever,23,189,2,nasal spray
504,5,"May 24, 2016",, 9,"“The positives for me were that it immediately helped with my itchy nose. However, it didn't completely get rid of it. I was taking it in the morning and at night and I felt so drugged and irritated. I really had to make myself do anything during the day. All I wanted to do was sleep. I've gone back to just suffering through my allergies during the day, and taking Benadryl at night. I've got two small children, so being excessively tires and cranky during the day isn't an option for me.”",Dymista,Hayfever,23,189,2,nasal spray
505,1,"May 23, 2016",, 13,"“I had went to urgent care after suffering with the worst sinus infection I have ever had, and I've had a few along with sinus surgeries.  The doc gave me a sample with no preface, just to try it, 1 squirt each nostril twice daily.  I took it at 7:30pm and felt like I had been drugged.  She told me nothing of the somnolent side effects and today its 2:30pm and I am still extremely drowsy, unfocused, and generally feeling like I could fall over.”",Dymista,Hayfever,23,189,2,nasal spray
506,5,"May 4, 2016",, 7,"“My teenaged son is congested from February through June. We live in the part of Texas where you can actually watch the cedar pollen pods explode (literally). I was so excited to hear all the promises of Dymista, but every squirt caused him to have crazy sneezing fits - like 15-20 in a row! We kept trying for 3 days, but he was miserable with the sneezing. Haven't seen any other reviews mention this, so I guess we are just special : /”",Dymista,Hayfever,23,189,2,nasal spray
507,10,"March 10, 2016",Taken for less than 1 month, 13,"“I got a sample 3 days ago and noticed improvement in 24 hours. My brain fog is gone, stuffiness greatly reduced and I feel better than I have for months if not years. I'll check in again after longer use. Right now I am wishing I had this at least a year ago.”",Dymista,Hayfever,23,189,2,nasal spray
508,3,"March 1, 2016",, 10,"“The taste is awful and does last for hours . I was also given the sample without prior knowledge that I should not be driving after use. I feel so out of it , drowsy, slight nausea. I'm still waiting for my insurance to let me know if this medication is covered and how much it will be even after the coupon card . At this point its not worth purchasing . Haven't noticed any positive change either in my sense of smell or nasal breathing ability.”",Dymista,Hayfever,23,189,2,nasal spray
509,2,"February 26, 2016",Taken for 2 to 5 years, 5,"“I found it to be not very effective. Yes, it helps some. for me it is less effective than flonase and Benadryl together.”",Dymista,Hayfever,23,189,2,nasal spray
510,10,"February 7, 2016",Taken for less than 1 month, 5,"“Works great! Works better then using both 2 nasal sprays individually. It is much more convenient to only have to use one nasal spray and is less irritating. If your insurance doesn't cover it ask your doctor to submit a prior authorization to your insurance. My doctor's office got Dymista approved in just a few hours. 
     Other options include using the Manufacturer's coupon from their website to get $100 off or a lower copay. Or buy the generic online from a reputable/verified International pharmacy for about $30 including shipping. Just make sure the pharmacy is verified by VIPS, has the physical address on the website, and requires a script. Generic Dymista not avail in US.”",Dymista,Hayfever,23,189,2,nasal spray
511,10,"January 13, 2016",Taken for less than 1 month, 12,"“After years of struggling with severe sinus pain, feeling exhausted on a daily basis due to all my allergies I now feel absolutely brilliant like I have been given a new lease of life.  I wish I had been prescribed this years ago.  The spray doesn't taste as that bad you just need a glass of water to wash taste away if it goes down your throat.  Highly recommend people who have allergic rhinitis to ask for this nasal spray, this hasn't cost me anything due to NHS prescriptions in England Uk”",Dymista,Hayfever,23,189,2,nasal spray
512,6,"January 13, 2016",, 15,"“I loved dymista when I started using it. Now after using several months I have horrible sores inside my nose, cold and hot chills, no energy to the point of not being able to get out of bed on my own, white spots just inside my nostrils. My nose is constantly bleeding and my family doctor justs laughs at me. I now have an appointment at an ENT.”",Dymista,Hayfever,23,189,2,nasal spray
513,9,"December 6, 2015",, 14,"“The taste is bad but it works!!! If you get the technique right it shouldn't go down the back of the throat, google how to do this. When I take it I have some mints standing by just in case, this helps mask the terrible taste. I have suffered from sinusitis/allergies for years, which completely block my nose. After about 4 days of using this twice a day this started working. Now my nose is completely clear and I take one pump in each nostril every day as a preventative. It is expensive, but it's the only long-term spray I've found. In Aus I pay about $55 for it.”",Dymista,Hayfever,23,189,2,nasal spray
514,1,"November 14, 2015",, 11,“I took it for 2-3 days twice a day and have lost my sense of smell...hope its not permanent.  No med is worth losing the ability to smell.”,Dymista,Hayfever,23,189,2,nasal spray
515,10,"November 4, 2015",, 7,“It really works effectively taken twice daily. I have tried everything that's available in market so far the best. With insurance and discount card I pay only $14.00 so its cheap.”,Dymista,Hayfever,23,189,2,nasal spray
516,10,"October 28, 2015",, 23,"“I had horrible sinus pressure headaches 3-4 days a week. It got to where OTC medication would only work for 3-4 hours then the pressure would be back. I went to an ENT who said I had rhinitis and gave me a prescription for Dymista and sent me for allergy testing. Came back I was allergic to a lot of things. The 1st week on dymista, I had 2 headaches. By the end of the 1st month, I had not had a headache in 2 weeks. I missed 6 weeks in, and the headache came back. I won't do that again!!! This medicine has been a huge game changer for me. A lot of reviewers talk about the taste. You need to shake the bottle lightly before using, and make sure and look at your toes with your head slightly bent down. Then the spray won't go down your throat.”",Dymista,Hayfever,23,189,2,nasal spray
517,9,"October 24, 2015",, 13,"“For many many years I have been dealing with hay fever allergies in spring and fall.  My nose is always clogged.  Sudafed and Allegra D became a normal routine for me.  Dr gave me a trial of this.  Loved it, the only side affect was that I could breath through my nose which is not normal for me in my life.  I actually felt more active but may be just a side affect from being able to breath through my nose.  They only get 9 of 10 because it is expensive, $180 without insurance, $80 with coupon card.  Insurance is fighting me with pre-authorization.”",Dymista,Hayfever,23,189,2,nasal spray
518,9,"October 20, 2015",, 14,"“After years of coughing all day, and sitting up choking many many nights with a sinus infection, my ENT in Tennesee, finally prescribed me dymista!  My infection went away with NO antibiotic. Now I don't cough at all! What a gift this is to my family. I do blow my nose immediately, since I'm sensitive to meds and I don't want extra. And I did have one or two anxiety attacks after taking, but I'm out of the Drs office and not coughing!!!! Coughing is exhausting. Praise God I am healed!”",Dymista,Hayfever,23,189,2,nasal spray
519,1,"October 13, 2015",, 9,"“Experienced choking, headaches and after using for 2 weeks progresssively worse nose bleeds.  I ended up in the emergency today, my nose is a mess inside.  Cauterizations two days in a row, patches put on the area that have been bleeding.  Now I can take no nasal spray until everything heals.  I have taken Nasonex for several years and like it but my mail pharmacy stopped carrying it.  Threw away 3 containers of the horrible Dymista.”",Dymista,Hayfever,23,189,2,nasal spray
520,1,"October 4, 2015",, 20,"“I have experienced awful side effects. Nausea, dizzy, dried out sinuses, nose bleeds, lightheadedness, and migraines like no other. Did help with allergies but not worth it!”",Dymista,Hayfever,23,189,2,nasal spray
521,10,"September 30, 2015",Taken for less than 1 month, 4,“Definately works on nasal and ocular symptoms and works really fast!!!!”,Dymista,Hayfever,23,189,2,nasal spray
522,,"September 15, 2015",, 6,"“I have been a user of Flonase for a long time, so I thought I would give this a try.  I got a sample from my doctor yesterday. After one use, I am unfortunately going to throw it in the garbage. It may very well work as advertised, but I just can't get over the awful, bitter tasting post-nasal drip that lingers for hours after use. After one use I don't feel like I can comment on its effectiveness, but I would rather be stuffy than taste it every day.”",Dymista,Hayfever,23,189,2,nasal spray
523,8,"August 19, 2015",, 3,"“Received a small sample from my doctor. I liked it she also gave me the card, to see if I can get it cheaper. Well with my Insurance it's $55, with the card $14.99. So I filled it today”",Dymista,Hayfever,23,189,2,nasal spray
524,10,"July 15, 2015",, 8,“I am also one of those people who seem to be allergic to everything and always suffering. My doctor recommended this and I've only been on it for a few days but it is already a game changer for me. The true test will be cedar season but I feel confident I will be okay. Thankful for the discount card!!”,Dymista,Hayfever,23,189,2,nasal spray
525,10,"July 3, 2015",, 4,“Works amazing! A life saver!!”,Dymista,Hayfever,23,189,2,nasal spray
526,9,"May 22, 2015",Taken for less than 1 month, 3,“Excellent reaction! Helped me within 5 days.  Actually thought the smell and taste was fine.”,Dymista,Hayfever,23,189,2,nasal spray
527,5,"May 5, 2015",Taken for less than 1 month, 15,"“Unaffordable. 
Insurance won't cover a cent and I can't shell out $109.99 per month for this spray. That's after using the $100 off discount card offered by the company. My pharmacy wants $209.99 a bottle. 
This is ridiculous.
 I would love some relief from my awful symptoms that leave me feeling too bad to even get out of bed half the year but I have had to revert back to other methods for minimal relief since there's no way a person on a normal income can afford the out of pocket pricing. I'm just not rich enough!”",Dymista,Hayfever,23,189,2,nasal spray
528,1,"May 4, 2015",, 11,"“Horrible, bitter taste. Lingers for hours then continues to drip down your throat and continues giving you a horrible awful taste. Did nothing for my nasal allergies, except a 10 min clear nasal way, but the taste didn't make this worth it.”",Dymista,Hayfever,23,189,2,nasal spray
529,2,"March 22, 2015",, 15,"“I did not have much luck with Dymista, might have dried me up a little, but was definitely not worth the HORRIBLE taste I had in my mouth for up to 4 hours afterwards.  Nothing would make the taste go away...soda, beer, bread, onions, even garlic.  Glad it worked for many of you, just didn't for me.”",Dymista,Hayfever,23,189,2,nasal spray
530,9,"October 5, 2014",Taken for less than 1 month, 21,"“Have used Dymista for a full week, but began noticing significant relief after about 5 days. Fall is usually a bad season for me (ragweed, mold, etc) but now I'm completely off the antihistamine & decongestant pills after taking various prescription forms for the past 30  years. Still a little post nasal drip but it works better than anything I've had in several years.”",Dymista,Hayfever,23,189,2,nasal spray
531,10,"September 9, 2014",, 16,"“I was ill for 4 months with allergies and felt sick and like I had the flu.  I think this was the worst I had. I went to a sinus specialist who prescribed Dymista and I have had very good results.  Clear nose, better sense of smell and I don't feel sick. I hope the Dymista will work well when the season hits again next March.”",Dymista,Hayfever,23,189,2,nasal spray
532,3,"August 27, 2014",Taken for less than 1 month, 7,"“Tried it for 10 days. For me, it worked no better than OTC sprays and my nose still runs like a faucet for two hours each morning.”",Dymista,Hayfever,23,189,2,nasal spray
533,10,"June 11, 2014",, 9,"“So far so good.  I have been using Dymista for 2 weeks & I can breathe out of both nostrils & I have a sense of smell again!  I used Nasonex for years & it worked well, but I seemed to build up a tolerance after awhile.  For the last couple of years I have been hooked on OTC nasal spray with horrible rebound congestion which required antibiotics & prednisone to kick. After this last round of antibiotics & prednisone & a change to Dymista. I can now breathe! I hope it continues.  I was even able to find a discount coupon online so I got it for $30.”",Dymista,Hayfever,23,189,2,nasal spray
534,9,"May 26, 2014",, 9,"“I have been suffering from extremely bad allergies for years.  Between my allergies and my asthma, I have had to use OTC nasal sprays, a combination of allergy medications and my asthma inhaler. I just started using Dymista and for the first time in years, I was able to breathe clearly.    I did not even need to use nasal spray! I am so glad I finally found Dymista!”",Dymista,Hayfever,23,189,2,nasal spray
535,10,"May 9, 2014",, 10,"“Best medicine on the market, unfortunately my insurance company refuses to pay for it which usually means I end up with bronchitis at least twice a year.”",Dymista,Hayfever,23,189,2,nasal spray
536,10,"January 16, 2014",Taken for 1 to 2 years, 26,"“The first several times of using this nasal spray almost made me barf. Actually, come to think of it, I did barf. However, I will say that this is the MOST effective nasal spray on the market! Most websites with information about Dymista (even their own website) are stating that it takes up to a week for the medication to work.  I have not had to wait that long.  For me, the spray works within seconds. I have allergies all year round. I visited my allergist and had a skin prick test done...allergic to everything...trees, pollen, dust, cockroach dust, grass, ..anything you can think of. I am not happy about the price, and am very hopeful that soon, the price will drop a little. ”",Dymista,Hayfever,23,189,2,nasal spray
537,9,"September 8, 2013",Taken for 1 to 6 months, 54,"“As a physician and a patient, I must say that Dymista is the best nasal decongestant spray I have ever used. I have used Flonase, Nasonex and Afrin. Flonase and Nasonex work well, but take 2-3 days before any significant relief is noted. Afrin is amazing for IMMEDIATE relief, but the rebound effects after a few days use are just too severe. I have found Dymista to be superior to all others as the antihistamine component works almost immediately providing relief from allergic causes, while the fluticasone is allowed a couple days to exhibit it's true anti inflammatory effects on the nasal mucosa. I am a recently graduated physician, and I will surely prescribe this medication to my future patients as a first line treatment.”",Dymista,Hayfever,23,189,2,nasal spray
538,10,"July 2, 2013",Taken for less than 1 month, 24,"“As someone who has had multiple hospitalisations every year due to chronic allergic asthma, I cannot believe how wonderful this medication is!!! It has enabled me to breathe properly through my nose for the first time in years!! I still take my oral antihistamine too but this spray is truly a miracle! I am on lots of medication daily and I can honestly say this is the first medication I have ever felt has actually 'worked' for me. In that I noticed a huge difference and improvement when taking it. Usually I never know if medication actually works but with this I can say for sure that it has been incredible.”",Dymista,Hayfever,23,189,2,nasal spray
539,5,"July 1, 2013",, 29,"“Dymista worked great on the swelling and pain in my sinuses, but I experienced several negative side effects so I discontinued use.  I felt jittery, anxious, nauseated and had diarrhea.”",Dymista,Hayfever,23,189,2,nasal spray
540,8,"March 20, 2013",Taken for less than 1 month, 15,"“I have mild allergic nasal inflammation with nighttime terbinate hypertrophy. I was afraid to even try nose spray this after reading a couple of less than good opinions. I'm very satisfied with Dymista. I have very mild allergic inflammation. I had terbinate reduction back in 2009 and was very satisfied with the procedure for a couple of years.  As warned my terbinate night time swelling gradually returned and had a very negative impact on the quality of my sleep.  For at least a year, I haven't had a nights sleep without waking 4 to 6 times a night rarely achieving REM sleep. Dymista has improved the quality of my sleep immediately.”",Dymista,Hayfever,23,189,2,nasal spray
